{
  "$schema": "../../schemas/r1-production-baseline-manifest.schema.json",
  "schemaVersion": "mathin-r1-production-baseline-v1",
  "example": true,
  "mode": "plan-only",
  "writesAllowed": false,
  "source": {
    "environment": "production-snapshot-source",
    "projectFingerprint": "1111111111111111111111111111111111111111111111111111111111111111",
    "databaseFingerprint": "2222222222222222222222222222222222222222222222222222222222222222"
  },
  "target": {
    "environment": "isolated-production-snapshot",
    "projectFingerprint": "3333333333333333333333333333333333333333333333333333333333333333",
    "databaseFingerprint": "4444444444444444444444444444444444444444444444444444444444444444"
  },
  "administrator": {
    "manifestPath": "docs/manifests/production-admin.example.json",
    "manifestSha256": "c0e41ffa51222f7ffbe1866727d9ac8b85a1f9838fd4b335acacbbb37f83c9fa"
  },
  "courseSystems": [
    {
      "key": "e-series",
      "courseCount": 90,
      "lectureIds": [
        "example-e-0001",
        "example-e-0002",
        "example-e-0003",
        "example-e-0004",
        "example-e-0005",
        "example-e-0006",
        "example-e-0007",
        "example-e-0008",
        "example-e-0009",
        "example-e-0010",
        "example-e-0011",
        "example-e-0012",
        "example-e-0013",
        "example-e-0014",
        "example-e-0015",
        "example-e-0016",
        "example-e-0017",
        "example-e-0018",
        "example-e-0019",
        "example-e-0020",
        "example-e-0021",
        "example-e-0022",
        "example-e-0023",
        "example-e-0024",
        "example-e-0025",
        "example-e-0026",
        "example-e-0027",
        "example-e-0028",
        "example-e-0029",
        "example-e-0030",
        "example-e-0031",
        "example-e-0032",
        "example-e-0033",
        "example-e-0034",
        "example-e-0035",
        "example-e-0036",
        "example-e-0037",
        "example-e-0038",
        "example-e-0039",
        "example-e-0040",
        "example-e-0041",
        "example-e-0042",
        "example-e-0043",
        "example-e-0044",
        "example-e-0045",
        "example-e-0046",
        "example-e-0047",
        "example-e-0048",
        "example-e-0049",
        "example-e-0050",
        "example-e-0051",
        "example-e-0052",
        "example-e-0053",
        "example-e-0054",
        "example-e-0055",
        "example-e-0056",
        "example-e-0057",
        "example-e-0058",
        "example-e-0059",
        "example-e-0060",
        "example-e-0061",
        "example-e-0062",
        "example-e-0063",
        "example-e-0064",
        "example-e-0065",
        "example-e-0066",
        "example-e-0067",
        "example-e-0068",
        "example-e-0069",
        "example-e-0070",
        "example-e-0071",
        "example-e-0072",
        "example-e-0073",
        "example-e-0074",
        "example-e-0075",
        "example-e-0076",
        "example-e-0077",
        "example-e-0078",
        "example-e-0079",
        "example-e-0080",
        "example-e-0081",
        "example-e-0082",
        "example-e-0083",
        "example-e-0084",
        "example-e-0085",
        "example-e-0086",
        "example-e-0087",
        "example-e-0088",
        "example-e-0089",
        "example-e-0090",
        "example-e-0091",
        "example-e-0092",
        "example-e-0093",
        "example-e-0094",
        "example-e-0095",
        "example-e-0096",
        "example-e-0097",
        "example-e-0098",
        "example-e-0099",
        "example-e-0100",
        "example-e-0101",
        "example-e-0102",
        "example-e-0103",
        "example-e-0104",
        "example-e-0105",
        "example-e-0106",
        "example-e-0107",
        "example-e-0108",
        "example-e-0109",
        "example-e-0110",
        "example-e-0111",
        "example-e-0112",
        "example-e-0113",
        "example-e-0114",
        "example-e-0115",
        "example-e-0116",
        "example-e-0117",
        "example-e-0118",
        "example-e-0119",
        "example-e-0120",
        "example-e-0121",
        "example-e-0122",
        "example-e-0123",
        "example-e-0124",
        "example-e-0125",
        "example-e-0126",
        "example-e-0127",
        "example-e-0128",
        "example-e-0129",
        "example-e-0130",
        "example-e-0131",
        "example-e-0132",
        "example-e-0133",
        "example-e-0134",
        "example-e-0135",
        "example-e-0136",
        "example-e-0137",
        "example-e-0138",
        "example-e-0139",
        "example-e-0140",
        "example-e-0141",
        "example-e-0142",
        "example-e-0143",
        "example-e-0144",
        "example-e-0145",
        "example-e-0146",
        "example-e-0147",
        "example-e-0148",
        "example-e-0149",
        "example-e-0150",
        "example-e-0151",
        "example-e-0152",
        "example-e-0153",
        "example-e-0154",
        "example-e-0155",
        "example-e-0156",
        "example-e-0157",
        "example-e-0158",
        "example-e-0159",
        "example-e-0160",
        "example-e-0161",
        "example-e-0162",
        "example-e-0163",
        "example-e-0164",
        "example-e-0165",
        "example-e-0166",
        "example-e-0167",
        "example-e-0168",
        "example-e-0169",
        "example-e-0170",
        "example-e-0171",
        "example-e-0172",
        "example-e-0173",
        "example-e-0174",
        "example-e-0175",
        "example-e-0176",
        "example-e-0177",
        "example-e-0178",
        "example-e-0179",
        "example-e-0180",
        "example-e-0181",
        "example-e-0182",
        "example-e-0183",
        "example-e-0184",
        "example-e-0185",
        "example-e-0186",
        "example-e-0187",
        "example-e-0188",
        "example-e-0189",
        "example-e-0190",
        "example-e-0191",
        "example-e-0192",
        "example-e-0193",
        "example-e-0194",
        "example-e-0195",
        "example-e-0196",
        "example-e-0197",
        "example-e-0198",
        "example-e-0199",
        "example-e-0200",
        "example-e-0201",
        "example-e-0202",
        "example-e-0203",
        "example-e-0204",
        "example-e-0205",
        "example-e-0206",
        "example-e-0207",
        "example-e-0208",
        "example-e-0209",
        "example-e-0210",
        "example-e-0211",
        "example-e-0212",
        "example-e-0213",
        "example-e-0214",
        "example-e-0215",
        "example-e-0216",
        "example-e-0217",
        "example-e-0218",
        "example-e-0219",
        "example-e-0220",
        "example-e-0221",
        "example-e-0222",
        "example-e-0223",
        "example-e-0224",
        "example-e-0225",
        "example-e-0226",
        "example-e-0227",
        "example-e-0228",
        "example-e-0229",
        "example-e-0230",
        "example-e-0231",
        "example-e-0232",
        "example-e-0233",
        "example-e-0234",
        "example-e-0235",
        "example-e-0236",
        "example-e-0237",
        "example-e-0238",
        "example-e-0239",
        "example-e-0240",
        "example-e-0241",
        "example-e-0242",
        "example-e-0243",
        "example-e-0244",
        "example-e-0245",
        "example-e-0246",
        "example-e-0247",
        "example-e-0248",
        "example-e-0249",
        "example-e-0250",
        "example-e-0251",
        "example-e-0252",
        "example-e-0253",
        "example-e-0254",
        "example-e-0255",
        "example-e-0256",
        "example-e-0257",
        "example-e-0258",
        "example-e-0259",
        "example-e-0260",
        "example-e-0261",
        "example-e-0262",
        "example-e-0263",
        "example-e-0264",
        "example-e-0265",
        "example-e-0266",
        "example-e-0267",
        "example-e-0268",
        "example-e-0269",
        "example-e-0270",
        "example-e-0271",
        "example-e-0272",
        "example-e-0273",
        "example-e-0274",
        "example-e-0275",
        "example-e-0276",
        "example-e-0277",
        "example-e-0278",
        "example-e-0279",
        "example-e-0280",
        "example-e-0281",
        "example-e-0282",
        "example-e-0283",
        "example-e-0284",
        "example-e-0285",
        "example-e-0286",
        "example-e-0287",
        "example-e-0288",
        "example-e-0289",
        "example-e-0290",
        "example-e-0291",
        "example-e-0292",
        "example-e-0293",
        "example-e-0294",
        "example-e-0295",
        "example-e-0296",
        "example-e-0297",
        "example-e-0298",
        "example-e-0299",
        "example-e-0300",
        "example-e-0301",
        "example-e-0302",
        "example-e-0303",
        "example-e-0304",
        "example-e-0305",
        "example-e-0306",
        "example-e-0307",
        "example-e-0308",
        "example-e-0309",
        "example-e-0310",
        "example-e-0311",
        "example-e-0312",
        "example-e-0313",
        "example-e-0314",
        "example-e-0315",
        "example-e-0316",
        "example-e-0317",
        "example-e-0318",
        "example-e-0319",
        "example-e-0320",
        "example-e-0321",
        "example-e-0322",
        "example-e-0323",
        "example-e-0324",
        "example-e-0325",
        "example-e-0326",
        "example-e-0327",
        "example-e-0328",
        "example-e-0329",
        "example-e-0330",
        "example-e-0331",
        "example-e-0332",
        "example-e-0333",
        "example-e-0334",
        "example-e-0335",
        "example-e-0336",
        "example-e-0337",
        "example-e-0338",
        "example-e-0339",
        "example-e-0340",
        "example-e-0341",
        "example-e-0342",
        "example-e-0343",
        "example-e-0344",
        "example-e-0345",
        "example-e-0346",